title,link,source,time,type
Eliem Therapeutics receives Investment Bank Analyst Rating Update,https://www.investing.com/news/pro/baird-maintains-climb-bio-at-outperform-with-a-price-target-of-12000-4546623,Investing.com,2026-03-06 12:15:00,Pro
Wedbush initiates Climb Bio stock with Outperform rating,https://www.investing.com/news/analyst-ratings/wedbush-initiates-climb-bio-stock-with-outperform-rating-93CH-4543864,Investing.com,2026-03-05 12:44:55,Free
Eliem Therapeutics receives Investment Bank Analyst Rating Update,https://www.investing.com/news/pro/wedbush-initiates-coverage-of-climb-bio-at-outperform-with-a-price-target-of-12000-4543583,Investing.com,2026-03-05 12:04:02,Pro
"Piper Sandler initiates Climb Bio stock with Overweight rating, $23 target",https://www.investing.com/news/analyst-ratings/piper-sandler-initiates-climb-bio-stock-with-overweight-rating-23-target-93CH-4504633,Investing.com,2026-02-13 09:39:04,Free
Eliem Therapeutics receives Investment Bank Analyst Rating Update,https://www.investing.com/news/pro/piper-sandler-initiates-coverage-of-climb-bio-at-overweight-with-a-price-target-of-23000-4504529,Investing.com,2026-02-13 08:57:02,Pro
Climb Bio advances clinical trials with first patients dosed in key studies,https://www.investing.com/news/company-news/climb-bio-advances-clinical-trials-with-first-patients-dosed-in-key-studies-93CH-4436842,Investing.com,2026-01-08 12:21:59,Free
Climb Bio begins dosing patients in membranous nephropathy trial,https://www.investing.com/news/assorted/climb-bio-begins-dosing-patients-in-membranous-nephropathy-trial-432SI-4436791,Investing.com,2026-01-08 12:07:05,Free
Climb Bio files lawsuit against Alumis over drug asset dispute,https://www.investing.com/news/assorted/climb-bio-files-lawsuit-against-alumis-over-drug-asset-dispute-432SI-4426874,Investing.com,2025-12-31 21:16:03,Free
Freedom Capital Markets initiates Buy rating on Climb Bio stock with $9 target,https://www.investing.com/news/analyst-ratings/freedom-capital-markets-initiates-buy-rating-on-climb-bio-stock-with-9-target-93CH-4425799,Investing.com,2025-12-30 20:48:59,Free
Eliem Therapeutics receives Investment Bank Analyst Rating Update,https://www.investing.com/news/pro/freedom-capital-markets-initiates-coverage-of-climb-bio-at-buy-with-a-price-target-of-9000-4425773,Investing.com,2025-12-30 20:13:02,Pro
H.C. Wainwright raises Climb Bio stock price target to $11 on budoprutug progress,https://www.investing.com/news/analyst-ratings/hc-wainwright-raises-climb-bio-stock-price-target-to-11-on-budoprutug-progress-93CH-4414908,Investing.com,2025-12-18 12:44:16,Free
Eliem Therapeutics receives Investment Bank Analyst Rating Update,https://www.investing.com/news/pro/hc-wainwright-maintains-climb-bio-at-buy-with-a-price-target-of-11000-4414639,Investing.com,2025-12-18 11:57:02,Pro
Monday’s Insider Moves: Prairie Operating Owner Leads Buying Spree,https://www.investing.com/news/stock-market-news/mondays-insider-moves-prairie-operating-owner-leads-buying-spree-93CH-4410769,Investing.com,2025-12-16 14:01:45,Free
Climb bio sees $754k in purchases from RA Capital funds,https://www.investing.com/news/insider-trading-news/climb-bio-sees-754k-in-purchases-from-ra-capital-funds-93CH-4409565,Investing.com,2025-12-16 00:59:56,Free
Form 8K Climb Bio Inc For: 11 December,https://www.investing.com/news/filings/form-8k-climb-bio-inc-for-11-december-93CH-4403403,Investing.com,2025-12-11 13:22:04,Free
Form 8K Climb Bio Inc For: 6 November,https://www.investing.com/news/filings/form-8k-climb-bio-inc-for-6-november-93CH-4337495,Investing.com,2025-11-06 12:21:06,Free
"Climb Bio names Adam Villa, Ashley Jones to senior VP roles",https://www.investing.com/news/assorted/climb-bio-names-adam-villa-ashley-jones-to-senior-vp-roles-432SI-4298740,Investing.com,2025-10-21 11:02:04,Free
William Blair initiates coverage on Climb Bio stock with Outperform rating,https://www.investing.com/news/analyst-ratings/william-blair-initiates-coverage-on-climb-bio-stock-with-outperform-rating-93CH-4291788,Investing.com,2025-10-16 10:50:08,Free
Eliem Therapeutics receives Investment Bank Analyst Rating Update,https://www.investing.com/news/pro/william-blair-initiates-coverage-of-climb-bio-at-outperform-4291602,Investing.com,2025-10-16 10:13:02,Pro
"H.C. Wainwright initiates Climb Bio stock with Buy rating, $9 price target",https://www.investing.com/news/analyst-ratings/hc-wainwright-initiates-climb-bio-stock-with-buy-rating-9-price-target-93CH-4283796,Investing.com,2025-10-13 11:24:54,Free
Eliem Therapeutics receives Investment Bank Analyst Rating Update,https://www.investing.com/news/pro/hc-wainwright-initiates-coverage-of-climb-bio-at-buy-with-a-price-target-of-9000-4283570,Investing.com,2025-10-13 10:47:02,Pro
Climb Bio appoints Susan Altschuller as chief financial officer,https://www.investing.com/news/sec-filings/climb-bio-appoints-susan-altschuller-as-chief-financial-officer-93CH-4267623,Investing.com,2025-10-01 21:40:07,Free
Climb Bio appoints Susan Altschuller as new CFO,https://www.investing.com/news/company-news/climb-bio-appoints-susan-altschuller-as-new-cfo-93CH-4265918,Investing.com,2025-10-01 11:05:07,Free
Climb Bio names Susan Altschuller as chief financial officer,https://www.investing.com/news/assorted/climb-bio-names-susan-altschuller-as-chief-financial-officer-432SI-4265895,Investing.com,2025-10-01 11:07:41,Free
Oppenheimer reaffirms Climb Bio stock rating on promising antibody data,https://www.investing.com/news/analyst-ratings/oppenheimer-reaffirms-climb-bio-stock-rating-on-promising-antibody-data-93CH-4263266,Investing.com,2025-09-30 12:08:52,Free
Eliem Therapeutics receives Investment Bank Analyst Rating Update,https://www.investing.com/news/pro/oppenheimer-maintains-climb-bio-at-outperform-with-a-price-target-of-10000-4263088,Investing.com,2025-09-30 11:27:03,Pro
Climb Bio stock price target raised to $8 from $7 at BTIG on CLYM116 potential,https://www.investing.com/news/analyst-ratings/climb-bio-stock-price-target-raised-to-8-from-7-at-btig-on-clym116-potential-93CH-4262921,Investing.com,2025-09-30 10:53:09,Free
Eliem Therapeutics receives Investment Bank Analyst Rating Update,https://www.investing.com/news/pro/btig-maintains-climb-bio-at-buy-with-a-price-target-of-8000-4262751,Investing.com,2025-09-30 10:17:03,Pro
Climb Bio reports promising preclinical data for IgA nephropathy drug,https://www.investing.com/news/company-news/climb-bio-reports-promising-preclinical-data-for-iga-nephropathy-drug-93CH-4260248,Investing.com,2025-09-29 11:05:07,Free
Climb Bio reports preclinical data for IgAN drug candidate,https://www.investing.com/news/assorted/climb-bio-reports-preclinical-data-for-igan-drug-candidate-432SI-4260220,Investing.com,2025-09-29 11:03:09,Free
Eliem Therapeutics receives Investment Bank Analyst Rating Update,https://www.investing.com/news/pro/baird-initiates-coverage-of-climb-bio-at-outperform-with-a-price-target-of-9000-4193675,Investing.com,2025-08-15 13:09:02,Pro
Climb Bio appoints Cindy Driscoll as SVP Finance and principal financial officer,https://www.investing.com/news/sec-filings/climb-bio-appoints-cindy-driscoll-as-svp-finance-and-principal-financial-officer-93CH-4101566,Investing.com,2025-06-18 14:34:42,Free
Climb Bio appoints new chief medical officer and finance executive,https://www.investing.com/news/company-news/climb-bio-appoints-new-chief-medical-officer-and-finance-executive-93CH-4100808,Investing.com,2025-06-18 11:05:17,Free
Climb Bio Appoints Edgar D. Charles as Chief Medical Officer,https://www.investing.com/news/assorted/climb-bio-appoints-edgar-d-charles-as-chief-medical-officer-432SI-4100792,Investing.com,2025-06-18 11:03:10,Free
Oppenheimer initiates coverage on Climb Bio stock with outperform rating,https://www.investing.com/news/analyst-ratings/oppenheimer-initiates-coverage-on-climb-bio-stock-with-outperform-rating-93CH-4084902,Investing.com,2025-06-06 11:42:58,Free
Eliem Therapeutics receives Investment Bank Analyst Rating Update,https://www.investing.com/news/pro/oppenheimer-initiates-coverage-of-climb-bio-at-outperform-with-a-price-target-of-10000-4084755,Investing.com,2025-06-06 10:57:02,Pro
"BTIG sets Climb Bio stock Buy rating, $7 target",https://www.investing.com/news/analyst-ratings/btig-sets-climb-bio-stock-buy-rating-7-target-93CH-4059243,Investing.com,2025-05-22 11:07:13,Free
Eliem Therapeutics receives Investment Bank Analyst Rating Update,https://www.investing.com/news/pro/btig-initiates-coverage-of-climb-bio-at-buy-with-a-price-target-of-7000-4059108,Investing.com,2025-05-22 10:31:02,Pro
Climb Bio Reports Inducement Grant Under Nasdaq Listing Rule 5635(c)(4),https://www.investing.com/news/press-releases/climb-bio-reports-inducement-grant-under-nasdaq-listing-rule-5635c4-93CH-4053710,Investing.com,2025-05-19 20:44:03,Free
Climb Bio Reports First Quarter 2025 Financial Results and Provides Business Updates,https://www.investing.com/news/press-releases/climb-bio-reports-first-quarter-2025-financial-results-and-provides-business-updates-93CH-4044467,Investing.com,2025-05-14 11:16:04,Free
CLYM stock touches 52-week low at $1.2 amid market challenges,https://www.investing.com/news/company-news/clym-stock-touches-52week-low-at-12-amid-market-challenges-93CH-3961243,Investing.com,2025-04-01 19:59:16,Free
Climb Bio expands board with two new directors,https://www.investing.com/news/sec-filings/climb-bio-expands-board-with-two-new-directors-93CH-3959803,Investing.com,2025-04-01 11:16:50,Free
Climb Bio Appoints Kim Cobleigh Drapkin and Bo Cumbo to its Board,https://www.investing.com/news/assorted/climb-bio-appoints-kim-cobleigh-drapkin-and-bo-cumbo-to-its-board-432SI-3959745,Investing.com,2025-04-01 11:05:29,Free
